{
  "$schema": "http://json-schema.org/draft-07/schema#",
  "$id": "mig_result.v1",
  "title": "Migration Eval Trial Result",
  "description": "Schema for per-trial result.json files emitted by the migration eval framework. See docs/migration_eval/README.md and docs/PRD.md for context.",
  "type": "object",
  "required": [
    "task_id",
    "agent_model",
    "migration_id",
    "success",
    "failure_class",
    "oracle_tier",
    "oracle_spec_sha",
    "recipe_spec_sha",
    "pre_reg_sha",
    "score_pre_cutoff",
    "score_post_cutoff"
  ],
  "properties": {
    "task_id": {
      "type": "string",
      "description": "Unique per-trial task identifier (e.g. 'oss-maven-sample-042')."
    },
    "agent_model": {
      "type": "string",
      "description": "Underlying language model identifier, e.g. 'claude-sonnet-4-6'."
    },
    "agent_runner": {
      "type": ["string", "null"],
      "description": "Optional agent runner / harness identifier, distinct from the underlying model. Examples: 'claude_code', 'amp', 'cursor', 'aider', 'custom'. Null or missing means the runner is unspecified — slice metrics by agent_model only."
    },
    "migration_id": {
      "type": "string",
      "description": "Migration identifier. Either a stable hand-authored recipe id (e.g. 'java8_17', 'python2_3') OR the first 12 hex chars of the prompt_sha when the migration is prompt-defined."
    },
    "success": {
      "type": "boolean",
      "description": "True iff the trial passed the reported oracle tier."
    },
    "failure_class": {
      "type": ["string", "null"],
      "enum": [
        "agent_error",
        "harness_error",
        "oracle_error",
        "infra_error",
        null
      ],
      "description": "PRD M6 four-way failure discrimination; null when success=true."
    },
    "oracle_tier": {
      "type": "string",
      "enum": [
        "diff_valid",
        "compile_only",
        "tests",
        "ast_conformance",
        "judge",
        "daikon"
      ],
      "description": "PRD M1 tiered oracle funnel stage that produced the pass/fail signal. 'diff_valid' is Tier-0 (cheap syntactic / patch-application check)."
    },
    "oracle_spec_sha": {
      "type": "string",
      "description": "SHA of the oracle spec in force when this trial was scored (PRD M8-lite)."
    },
    "recipe_spec_sha": {
      "type": "string",
      "description": "SHA of the migration recipe spec in force for this trial (PRD M8-lite)."
    },
    "pre_reg_sha": {
      "type": "string",
      "description": "SHA of the pre-registered hypotheses_and_thresholds.md file (PRD M8-lite)."
    },
    "prompt_sha": {
      "type": ["string", "null"],
      "description": "Optional SHA of the agent prompt file when the migration is prompt-defined rather than recipe-defined. Enforced by the publication gate when manifest.json declares a 'prompt_spec' key (PRD M8-lite extension)."
    },
    "score_pre_cutoff": {
      "type": "number",
      "description": "PRD M7 contamination-split score for repos created BEFORE the model training cutoff."
    },
    "score_post_cutoff": {
      "type": "number",
      "description": "PRD M7 contamination-split score for repos created AFTER the model training cutoff."
    }
  },
  "additionalProperties": true
}
