{
  "task_id": "oss-maven-sample-042",
  "agent_model": "claude-sonnet-4-6",
  "migration_id": "java8_17",
  "success": true,
  "failure_class": null,
  "oracle_tier": "compile_only",
  "oracle_spec_sha": "a1b2c3d4e5f67890a1b2c3d4e5f67890a1b2c3d4",
  "recipe_spec_sha": "c3d4e5f67890a1b2c3d4e5f67890a1b2c3d4e5f6",
  "pre_reg_sha": "e5f67890a1b2c3d4e5f67890a1b2c3d4e5f67890",
  "score_pre_cutoff": 0.82,
  "score_post_cutoff": 0.78
}
