{
  "task_id": "oss-maven-stamped-002",
  "agent_model": "claude-sonnet-4-6",
  "migration_id": "java8_17",
  "success": false,
  "failure_class": "oracle_error",
  "oracle_tier": "tests",
  "oracle_spec_sha": "79a65900fe2da5252ed173c18c125a06a99b25014e5398b545e167a7354e8b2f",
  "recipe_spec_sha": "2eeae1feba028ac9eb9007c1906406af6a3a6d6434e632c1b4a6d894824d0b7c",
  "pre_reg_sha": "be442aa241ac97f5aa7208fa7fcb85efaf66b2275c4b1382e3800bc4a86f87ea",
  "score_pre_cutoff": 0.62,
  "score_post_cutoff": 0.58
}
