{
  "task_id": "oss-maven-unstamped-002",
  "agent_model": "claude-sonnet-4-6",
  "migration_id": "java8_17",
  "success": false,
  "failure_class": "agent_error",
  "oracle_tier": "tests",
  "oracle_spec_sha": "deadbeefdeadbeefdeadbeefdeadbeefdeadbeefdeadbeefdeadbeefdeadbeef",
  "recipe_spec_sha": "cafef00dcafef00dcafef00dcafef00dcafef00dcafef00dcafef00dcafef00d",
  "pre_reg_sha": "",
  "score_pre_cutoff": 0.55,
  "score_post_cutoff": 0.41
}
